Country,Title,Price,Minimum_Order,URL
CN,Washing Machine Twin Washing Machine 6.8kg Twin Tub/semi Auto Washing Machine XPB68-2001SD1,$20.00-$100.00,223 Pieces,https://www.alibaba.com///www.alibaba.com/product-detail/Washing-Machine-Twin-Washing-Machine-6_485304511.html
CN,Washing Machine Industrial Washing Machine Prices Industrial Washing Machine And Dryer For Laundromat Coin Dryer Price,"$2,800.00",1 Set,https://www.alibaba.com///www.alibaba.com/product-detail/Washing-Machine-Industrial-Washing-Machine-Prices_62280096615.html?s=p
CN,Washing Machine Coin Operated Washing Machines 10kg 12kg 15kg 20kg Coin Operated Washing Machine,"$2,300.00",1 Set,https://www.alibaba.com///www.alibaba.com/product-detail/Washing-Machine-Coin-Operated-Washing-Machines_60809864264.html?s=p
CN,Washing Machine Machine Washing Machine Front Tilting Clothes Washer Automatic Washing Machine For Industrial Laundry,"$2,000.00-$3,000.00",1.0 Units,https://www.alibaba.com///www.alibaba.com/product-detail/Washing-Machine-Machine-Washing-Machine-Front_62552145891.html?s=p
CN,Washing Machine Coin-operated Washing Machine Price Coin-operated Washing Machine Price,"$2,200.00-$2,400.00",1 Set,https://www.alibaba.com///www.alibaba.com/product-detail/Washing-Machine-Coin-operated-Washing-Machine_60726799592.html?s=p
CN,Washing Machine Portable Foldable Mini Washing Machine,$14.60-$18.70,1 Piece,https://www.alibaba.com///www.alibaba.com/product-detail/Washing-Machine-Portable-Foldable-Mini-Washing_1600132490925.html?s=p
CN,8kg 10kg 12kg 14kg 18kg 220v full automatic front loading washing machine,$200.00-$300.00,152.0 Pieces,https://www.alibaba.com///www.alibaba.com/product-detail/8kg-10kg-12kg-14kg-18kg-220v_62045206271.html
CN,7kg small washing machine semi-automatic single-tub large-capacity household with dehydration drying and washing integrated,$33.84-$38.46,1 Piece,https://www.alibaba.com///www.alibaba.com/product-detail/7kg-small-washing-machine-semi-automatic_1600089546811.html
CN,Personal portable mini baby clothes single drum washing machine,$14.55-$15.65,2 Pieces,https://www.alibaba.com///www.alibaba.com/product-detail/Personal-portable-mini-baby-clothes-single_62374198043.html
CN,8kg 10kg 12kg 14kg 18kg 220v full automatic top loading washing machine,$73.00-$81.00,2 Pieces,https://www.alibaba.com///www.alibaba.com/product-detail/8kg-10kg-12kg-14kg-18kg-220v_1600144062158.html
CN,Home Baby Mini Electric Washer Washing And Drying Machine Shoe And Cloth Small Portable Washing Machine,$14.31-$16.23,10 Pieces,https://www.alibaba.com///www.alibaba.com/product-detail/Home-Baby-Mini-Electric-Washer-Washing_62566469369.html
CN,folding washing machine mini for Baby/lady and Camper/RV portable mini washer,$24.00-$30.00,300.0 Pieces,https://www.alibaba.com///www.alibaba.com/product-detail/folding-washing-machine-mini-for-Baby_62502319731.html
CN,Practical home twin tub washing machine semi-automatic drum washing machine,$43.00-$50.00,272 Pieces,https://www.alibaba.com///www.alibaba.com/product-detail/Practical-home-twin-tub-washing-machine_1600089033428.html
CN,110v/220v Twin tube washing machine automatic portable washing machine marine washing machine,$35.00-$45.00,1 Set,https://www.alibaba.com///www.alibaba.com/product-detail/110v-220v-Twin-tube-washing-machine_62551056076.html
CN,Mini Portable Ultrasonic Turbine Washing Machine Foldable Bucket Type USB Laundry Clothes Washer Cleaner for Home Travel,$7.39-$8.99,100 Pieces,https://www.alibaba.com///www.alibaba.com/product-detail/Mini-Portable-Ultrasonic-Turbine-Washing-Machine_1600099925324.html
CN,Weili Fully automatic washer Stainless Steel Inner Drum 8kg washing machine,$106.00-$109.00,500 Pieces,https://www.alibaba.com///www.alibaba.com/product-detail/Weili-Fully-automatic-washer-Stainless-Steel_1600103062721.html
CN,Hotsale Personal USB Ultrasonic Turbine Washer Portable Mini Washing Machine for Travel and Children's Laundry,$7.75-$9.50,2 Pieces,https://www.alibaba.com///www.alibaba.com/product-detail/Hotsale-Personal-USB-Ultrasonic-Turbine-Washer_62012306724.html
CN,3.5 kg shoes washing and drying machine,$29.50-$42.00,2 Pieces,https://www.alibaba.com///www.alibaba.com/product-detail/3-5-kg-shoes-washing-and_62260574855.html
CN,New Third Generation Upgraded smart Panel Ultrasound mini Portable Washing Machines 110V/220V,$25.00-$32.00,1 Piece,https://www.alibaba.com///www.alibaba.com/product-detail/New-Third-Generation-Upgraded-smart-Panel_62075472732.html
CN,Multifunctional washing machine/shoe washing machine semi-automatic small single bucket baby,$25.00-$34.00,1 Piece,https://www.alibaba.com///www.alibaba.com/product-detail/Multifunctional-washing-machine-shoe-washing-machine_1600090069331.html
CN,newest Single Tub portable Mini Washing Machine with dryer,$23.00-$30.00,1 Unit,https://www.alibaba.com///www.alibaba.com/product-detail/newest-Single-Tub-portable-Mini-Washing_60089425088.html
CN,Travel Multi-function Semi-automatic Portable Mini Folding Laundry Tub Washing Machine,$20.00-$30.00,30.0 Pieces,https://www.alibaba.com///www.alibaba.com/product-detail/Travel-Multi-function-Semi-automatic-Portable_1600101455411.html
CN,new model mini baby use foldable washing machine 1.8kg,$22.00-$50.00,1 Piece,https://www.alibaba.com///www.alibaba.com/product-detail/new-model-mini-baby-use-foldable_1600143045276.html
CN,Mini lavadora portatil Ultrasound Turbo Washer Mini Travel Portable Washing Machine for Underwear panties socks cleaning,$6.00-$7.00,8000 Pieces,https://www.alibaba.com///www.alibaba.com/product-detail/Mini-lavadora-portatil-Ultrasound-Turbo-Washer_60833993953.html
CN,Cheap Factory Price 110-240V Supply 10 Kg Washing Machine Price,$140.00-$255.00,162.0 Pieces,https://www.alibaba.com///www.alibaba.com/product-detail/Cheap-Factory-Price-110-240V-Supply_1600067334162.html
CN,Different color foot pedal mini portable washing machine with dryer,$18.00-$25.00,100 Pieces,https://www.alibaba.com///www.alibaba.com/product-detail/Different-color-foot-pedal-mini-portable_1446379890.html
CN,6KG BIG CAPACITY FULLY AUTOMATIC TOP LOADING WASHING MACHINE FOR HOME,$86.00-$90.00,50 Pieces,https://www.alibaba.com///www.alibaba.com/product-detail/6KG-BIG-CAPACITY-FULLY-AUTOMATIC-TOP_1600124439935.html
CN,Make-up Cosmetics Beauty Cosmetics Mini Washing Machine for Blender Skin Care,$0.89-$2.50,1 Piece,https://www.alibaba.com///www.alibaba.com/product-detail/Make-up-Cosmetics-Beauty-Cosmetics-Mini_1600093125386.html
CN,High Quality 4.5kg Mini Washing Machine,$14.55-$15.65,2 Pieces,https://www.alibaba.com///www.alibaba.com/product-detail/High-Quality-4-5kg-Mini-Washing_1600153891543.html
CN,MINI Washing Machine Used to Washing Clothes and Shoes,$33.78-$33.90,1.0 Pieces,https://www.alibaba.com///www.alibaba.com/product-detail/MINI-Washing-Machine-Used-to-Washing_1600106018847.html
CN,Mini single folding washing machine,$16.82-$24.94,2 Pieces,https://www.alibaba.com///www.alibaba.com/product-detail/Mini-single-folding-washing-machine_62232917362.html
CN,2021 trends portable washing machine mini portable mini folding wash machine folding portable washing machine,$29.00-$38.00,10 Sets,https://www.alibaba.com///www.alibaba.com/product-detail/2021-trends-portable-washing-machine-mini_1600097280607.html
CN,New hot 3kg Mini Baby Clothes Single Tub Washing Machine with Spin Dryer,$21.00-$22.00,100 Pieces,https://www.alibaba.com///www.alibaba.com/product-detail/New-hot-3kg-Mini-Baby-Clothes_60822118926.html
CN,Semi Automatic Washing Machine 7kg Multifunction Energy Saving Design Simple Operation Factory Wholesale High Quality Best Price,$28.50-$40.50,100 Pieces,https://www.alibaba.com///www.alibaba.com/product-detail/Semi-Automatic-Washing-Machine-7kg-Multifunction_1600142065512.html
CN,New Arrival High quality Semi- Auto Mini Household Shoe Washing Machine,$65.88-$75.88,1 Unit,https://www.alibaba.com///www.alibaba.com/product-detail/New-Arrival-High-quality-Semi-Auto_62278877284.html
CN,Fully Automatic Front Loading Washing Machine Dryer 8kg washing machine,$160.00-$340.00,161.0 Sets,https://www.alibaba.com///www.alibaba.com/product-detail/Fully-Automatic-Front-Loading-Washing-Machine_1600060963964.html
JP,Used Washing Machines from Japan,$6.65-$9.50,100.0 Units,https://www.alibaba.com///www.alibaba.com/product-detail/Used-Washing-Machines-from-Japan_62024895205.html
CN,Mini Portable Ultrasonic Washing Machine Folding Washer USB Type Bucket Laundry Clothes Washing Machine,$12.50-$17.00,200.0 Pieces,https://www.alibaba.com///www.alibaba.com/product-detail/Mini-Portable-Ultrasonic-Washing-Machine-Folding_1600084139829.html
CN,Portable Foldable Mini Washing Machine,$14.60-$18.70,1 Piece,https://www.alibaba.com///www.alibaba.com/product-detail/Portable-Foldable-Mini-Washing-Machine_1600132490925.html
CN,Mini Portable Top Loading Washing Machine Automatic Laundry,$97.00,375 Units,https://www.alibaba.com///www.alibaba.com/product-detail/Mini-Portable-Top-Loading-Washing-Machine_1600114118115.html
CN,Household Small Mini Home Use Drying Shoes Washing Machine,$23.10-$35.60,500.0 Pieces,https://www.alibaba.com///www.alibaba.com/product-detail/Household-Small-Mini-Home-Use-Drying_1600104978372.html
CN,10L bucket type folding mini portable laundry machine clothes washing machine,$20.00,1 Piece,https://www.alibaba.com///www.alibaba.com/product-detail/10L-bucket-type-folding-mini-portable_1600149767561.html
CN,"Mini shoe washing machine,semi-automatic 4.5kg personal household",$16.00-$20.00,5 Sets,https://www.alibaba.com///www.alibaba.com/product-detail/Mini-shoe-washing-machine-semi-automatic_1600096787089.html
CN,Portable small size laundry clothes washer 2kg mini electric washing machine,$22.07-$23.56,1 Piece,https://www.alibaba.com///www.alibaba.com/product-detail/Portable-small-size-laundry-clothes-washer_62166571706.html
CN,2020 new twin tub washing machine household twin tub washing machine 14kg twin tub washing machine 14kg,$49.00-$89.00,500 Sets,https://www.alibaba.com///www.alibaba.com/product-detail/2020-new-twin-tub-washing-machine_1600134941227.html
CN,2020 new home use big barrel 7.8 kg of large capacity semi-automatic washing machines,$33.00-$36.00,50 Pieces,https://www.alibaba.com///www.alibaba.com/product-detail/2020-new-home-use-big-barrel_1600111911203.html
CN,Hottes Produce 2020t folding bucket washer mini single automatic washing machine for underwear socks,$13.29-$15.15,2 Pieces,https://www.alibaba.com///www.alibaba.com/product-detail/Hottes-Produce-2020t-folding-bucket-washer_1600113273880.html
CN,12kg Clothes Washer Twin Tub Semi Automatic Washing Machine With Dryer,$297.90-$328.90,1 Piece,https://www.alibaba.com///www.alibaba.com/product-detail/12kg-Clothes-Washer-Twin-Tub-Semi_1600104312677.html
CN,New Folding And Sorting Mini Washing Machine,$23.00-$25.00,600 Pieces,https://www.alibaba.com///www.alibaba.com/product-detail/New-Folding-And-Sorting-Mini-Washing_1600077351923.html
CN,10kg Semi automatic Twin tub washing machine,$60.00-$70.00,160.0 Pieces,https://www.alibaba.com///www.alibaba.com/product-detail/10kg-Semi-automatic-Twin-tub-washing_1600086019342.html
CN,6-10KG electric automatic household drum frout loading Portable the Washing Machine with dryer,$185.00-$290.00,50.0 Pieces,https://www.alibaba.com///www.alibaba.com/product-detail/6-10KG-electric-automatic-household-drum_60749327652.html
IN,Home washing machine laundry machine semi automatic washing machine big capacity,$110.00-$125.00,600 Units,https://www.alibaba.com///www.alibaba.com/product-detail/Home-washing-machine-laundry-machine-semi_144035349.html
CN,Frequency conversion drum washing machine 1F 10kg,$218.00-$229.00,1 Piece,https://www.alibaba.com///www.alibaba.com/product-detail/Frequency-conversion-drum-washing-machine-1F_1600108752170.html
CN,2020 Folding Ozone Disinfection Washer Mini Bucket Automatic Washing Machine For Underwear With Washboard,$24.40-$29.00,2 Pieces,https://www.alibaba.com///www.alibaba.com/product-detail/2020-Folding-Ozone-Disinfection-Washer-Mini_1600109504790.html
CN,MARINE STORE WHOLESALER TWIN TUB WASHING MACHINE 7.8KG 110V 60Hz IMPA CODE 174701,$40.00-$80.00,1 Piece,https://www.alibaba.com///www.alibaba.com/product-detail/MARINE-STORE-WHOLESALER-TWIN-TUB-WASHING_60788913179.html
CN,Amazon top seller semi-automatic Washing Machine mini portable folding machine with dryer bin for travel and dormitory use,$23.99-$24.99,100 Pieces,https://www.alibaba.com///www.alibaba.com/product-detail/Amazon-top-seller-semi-automatic-Washing_1600068413345.html
CN,110V 60HZ Electric Front Load Washing Machine,$180.00-$230.00,10 Sets,https://www.alibaba.com///www.alibaba.com/product-detail/110V-60HZ-Electric-Front-Load-Washing_62271026659.html
CN,Ideal For Limited Spaces Portable Mini Washing Machine with Spin Dryer,$28.00-$35.00,10 Pieces,https://www.alibaba.com///www.alibaba.com/product-detail/Ideal-For-Limited-Spaces-Portable-Mini_1600116980951.html
CN,Moyu Travel Portable Mini Folding Wash Machine Automatic Small Household Underwear Washer and Dryer Laundry Machine,$145.89-$155.89,10.0 Pieces,https://www.alibaba.com///www.alibaba.com/product-detail/Moyu-Travel-Portable-Mini-Folding-Wash_1600079065583.html
CN,Popular 4.5KG Mini Washing Machine For Washer With Dryer,$25.00,500 Sets,https://www.alibaba.com///www.alibaba.com/product-detail/Popular-4-5KG-Mini-Washing-Machine_1600140834444.html
CN,Turbine Machine Bucket Mini Hand Washing Machine Portable,$37.90-$38.90,1 Piece,https://www.alibaba.com///www.alibaba.com/product-detail/Turbine-Machine-Bucket-Mini-Hand-Washing_62043859380.html
CN,Twin tub washing machine with cheapest price,$58.20-$116.40,1 Piece,https://www.alibaba.com///www.alibaba.com/product-detail/Twin-tub-washing-machine-with-cheapest_60770449196.html
CN,Wholesale price hotselling cosmetic private logo mini portable washing machine,$2.20-$2.80,50.0 Pieces,https://www.alibaba.com///www.alibaba.com/product-detail/Wholesale-price-hotselling-cosmetic-private-logo_1600106380316.html
CN,2020 Outside Foldable Silicone Portable Mini Washing Machine For Traveling Third Generation,$0.50-$120.00,1 Piece,https://www.alibaba.com///www.alibaba.com/product-detail/2020-Outside-Foldable-Silicone-Portable-Mini_1600076785961.html
CN,2020 Mini folding washing machine silicone electric mini portable folding washing machine for traveling,$28.00-$35.00,10 Pieces,https://www.alibaba.com///www.alibaba.com/product-detail/2020-Mini-folding-washing-machine-silicone_1600114402100.html
CN,outside foldable silicone electric mini portable Automatic washing machine for traveling,$36.00-$40.00,3 Packs,https://www.alibaba.com///www.alibaba.com/product-detail/outside-foldable-silicone-electric-mini-portable_1600094126653.html
CN,8.5kg fully-automatic washing machine XQP85-818-E,$106.00-$110.00,150 Cartons,https://www.alibaba.com///www.alibaba.com/product-detail/8-5kg-fully-automatic-washing-machine_62272953838.html
CN,one pair shoe washing machine (SW0026) UK Plug,$20.59-$23.50,100 Pieces,https://www.alibaba.com///www.alibaba.com/product-detail/one-pair-shoe-washing-machine-SW0026_62393364470.html
CN,Wholesale Mini Small UV Sterilization Washing Machine smart baby clothes automatic Washing Machine,$32.00-$36.00,100 Pieces,https://www.alibaba.com///www.alibaba.com/product-detail/Wholesale-Mini-Small-UV-Sterilization-Washing_1600147048325.html
CN,New wholesale portable ultrasonic turbine washing machine 2018,$11.75-$12.05,1 Piece,https://www.alibaba.com///www.alibaba.com/product-detail/New-wholesale-portable-ultrasonic-turbine-washing_60820659796.html
CN,7kg 8kg 9kg 10kg home manual top load twin tub laundry washing machine,$297.90-$328.90,10 Pieces,https://www.alibaba.com///www.alibaba.com/product-detail/7kg-8kg-9kg-10kg-home-manual_1600103822867.html
CN,Folding small mini washing machine Portable washing machine Laundry artifact Super magic wave sterilization Factory direct sales,$28.00,2 Pieces,https://www.alibaba.com///www.alibaba.com/product-detail/Folding-small-mini-washing-machine-Portable_1600108860965.html
CN,mini portable compact ultrasonic turbine folding pail laundry laundry washing machine,$9.00-$20.00,10 Pieces,https://www.alibaba.com///www.alibaba.com/product-detail/mini-portable-compact-ultrasonic-turbine-folding_1600095901408.html
CN,Hot Sale Creative Smart Laundry Portable Clothes Mini Wash Machine For Travel,$15.00-$18.00,2 Pieces,https://www.alibaba.com///www.alibaba.com/product-detail/Hot-Sale-Creative-Smart-Laundry-Portable_60775029858.html
CN,2020 Folding Bucket Ozone Disinfection vegetable Washer Mini Automatic car Washing Machine,$36.50,500 Pieces,https://www.alibaba.com///www.alibaba.com/product-detail/2020-Folding-Bucket-Ozone-Disinfection-vegetable_1600084474233.html
CN,2021 Factory Directly Mini Hand Washing Machines Portable USB Washing Machines For Clothes,$6.90-$8.50,500 Units,https://www.alibaba.com///www.alibaba.com/product-detail/2021-Factory-Directly-Mini-Hand-Washing_62422008518.html
CN,Professional home use washing machine with single tub,$200.00-$800.00,5 Sets,https://www.alibaba.com///www.alibaba.com/product-detail/Professional-home-use-washing-machine-with_60439908392.html
CN,Automatic household drum washing and drying one 12 kg,$280.00-$300.00,150 Cartons,https://www.alibaba.com///www.alibaba.com/product-detail/Automatic-household-drum-washing-and-drying_62289929057.html
CN,2020 New design hot sell product mini folding washing machine mini washer,$50.00-$55.00,10 Pieces,https://www.alibaba.com///www.alibaba.com/product-detail/2020-New-design-hot-sell-product_1700001713214.html
CN,Portable Ultrasonic Turbine Washing Machine Foldable Bucket Type USB Laundry Clothes Washer Cleaner for Home Travel,$4.00-$8.00,100.0 Pieces,https://www.alibaba.com///www.alibaba.com/product-detail/Portable-Ultrasonic-Turbine-Washing-Machine-Foldable_62211900022.html
CN,Mini clothes lazy washing machine ultrasonic turbine washing machine USB laundry cleaner home travel,$7.00-$8.50,200.0 Pieces,https://www.alibaba.com///www.alibaba.com/product-detail/Mini-clothes-lazy-washing-machine-ultrasonic_1600085222679.html
CN,usb static state washing device ultrasonic shoe washing machine full automatic home disinfection shoes cleaner,$24.99-$30.00,2.0 Pieces,https://www.alibaba.com///www.alibaba.com/product-detail/usb-static-state-washing-device-ultrasonic_1600159111041.html
CN,Wholesale Mini Washing Underwear Machine Lightweight Foldable Ultrasonic Turbine Washer USB Power Travel Laundry Washer,$17.15-$19.21,1 Piece,https://www.alibaba.com///www.alibaba.com/product-detail/Wholesale-Mini-Washing-Underwear-Machine-Lightweight_1600080961599.html
CN,mini semi-automatic shoe washer Mini smart lazy person wash shoes Dormitory brush shoes gifts,$23.00-$26.00,2 Pieces,https://www.alibaba.com///www.alibaba.com/product-detail/mini-semi-automatic-shoe-washer-Mini_1600151300250.html
CN,Portable folding washing machine household small mini travel laundry bucket with spin-drying underwear and underwear washout,$55.00-$65.00,10 Pieces,https://www.alibaba.com///www.alibaba.com/product-detail/Portable-folding-washing-machine-household-small_1600119561360.html
CN,Household Small Home Use Drying Portable Mini Shoes Washing Machine,$115.00-$119.00,10 Units,https://www.alibaba.com///www.alibaba.com/product-detail/Household-Small-Home-Use-Drying-Portable_1600137366066.html
CN,automatic industrial washing machine,"$2,000.00-$20,000.00",1.0 Sets,https://www.alibaba.com///www.alibaba.com/product-detail/automatic-industrial-washing-machine_60571970351.html
CN,4.5KG Washing Machine Top Loading Washing Machine Washing Machine Top Loading,$65.00-$81.25,2 Pieces,https://www.alibaba.com///www.alibaba.com/product-detail/4-5KG-Washing-Machine-Top-Loading_1600074798766.html
CN,whirlpool design 8kg fully automatic top loading washing machine / laundry machine,$130.00-$160.00,300.0 Pieces,https://www.alibaba.com///www.alibaba.com/product-detail/whirlpool-design-8kg-fully-automatic-top_60604669785.html
CN,3.8kg High capacity Single Tub Semi-automatic Antibacterial garment washer Electric mini clothes washing machine 170W 220v 1pc,$81.00,2 Pieces,https://www.alibaba.com///www.alibaba.com/product-detail/3-8kg-High-capacity-Single-Tub_62266618089.html
CN,Newest Design Travel Mini Portable Lazy Laundry Ultrasonic Washer USB Mini Fruit And Vegetable Cleaning Washing Machine,$7.85-$9.90,2 Boxes,https://www.alibaba.com///www.alibaba.com/product-detail/Newest-Design-Travel-Mini-Portable-Lazy_62153892107.html
CN,8KG Double layers body toughened glass cover twin tub washing machine,$40.00-$65.00,177 Pieces,https://www.alibaba.com///www.alibaba.com/product-detail/8KG-Double-layers-body-toughened-glass_598631697.html
CN,5 Gallon Bottle Washing Machine,"$6,000.00-$7,000.00",1 Set,https://www.alibaba.com///www.alibaba.com/product-detail/5-Gallon-Bottle-Washing-Machine_1254265684.html
CN,Mini Portable Ultrasonic Vibration Washing Machine Stains Remover USB Ultrasound Laundry Clean Machine Turbine Washer for Travel,$9.00-$12.00,100.0 Pieces,https://www.alibaba.com///www.alibaba.com/product-detail/Mini-Portable-Ultrasonic-Vibration-Washing-Machine_62593893937.html
CN,Portable Ultrasonic Turbine Washing Machine Foldable Bucket Type USB Laundry Clothes Washer Cleaner for Home Travel,$4.00-$8.00,100.0 Pieces,https://www.alibaba.com///www.alibaba.com/product-detail/Portable-Ultrasonic-Turbine-Washing-Machine-Foldable_62211900022.html
CN,High quality dirty rock and alluvial sand ore washing machine rotary drum scrubber,"$7,600.00",1 Set,https://www.alibaba.com///www.alibaba.com/product-detail/High-quality-dirty-rock-and-alluvial_60820455484.html
CN,Portable Folding Bucket Type USB Travel Washing Machine Underpants Sock Ultrasonic Disinfect Laundry,$39.50-$41.94,1 Piece,https://www.alibaba.com///www.alibaba.com/product-detail/Portable-Folding-Bucket-Type-USB-Travel_1600141016044.html
CN,usb static state washing device ultrasonic shoe washing machine full automatic home disinfection shoes cleaner,$24.99-$30.00,2.0 Pieces,https://www.alibaba.com///www.alibaba.com/product-detail/usb-static-state-washing-device-ultrasonic_1600159111041.html
CN,Portable folding washing machine household small mini travel laundry bucket with spin-drying underwear and underwear washout,$55.00-$65.00,10 Pieces,https://www.alibaba.com///www.alibaba.com/product-detail/Portable-folding-washing-machine-household-small_1600119561360.html
CN,6.5kg Portable Shoes Washing Machine Washing And Drying Machine Home Mini Small UV Bacteriostasis Electric Washing Machine,$21.61-$26.12,10 Pieces,https://www.alibaba.com///www.alibaba.com/product-detail/6-5kg-Portable-Shoes-Washing-Machine_62567381490.html
CN,"Mini folding washing machine,semi-automatic portable travel multi-function plastic 1.8kg",$45.50-$49.80,2 Pieces,https://www.alibaba.com///www.alibaba.com/product-detail/Mini-folding-washing-machine-semi-automatic_1600075034179.html
CN,"Outside foldable silicone electric washing machine with dryer, portable mini washing machine with sterilizing for traveling",$33.00-$45.00,1 Box,https://www.alibaba.com///www.alibaba.com/product-detail/Outside-foldable-silicone-electric-washing-machine_1600108686593.html
CN,Wholesale Upgraded Version Portable Ultrasonic Mini Washing Machine for Travel,$6.95-$8.50,2 Pieces,https://www.alibaba.com///www.alibaba.com/product-detail/Wholesale-Upgraded-Version-Portable-Ultrasonic-Mini_62042357478.html
CN,6.8 kg clothes washing machine,$48.00,258 Pieces,https://www.alibaba.com///www.alibaba.com/product-detail/6-8-kg-clothes-washing-machine_60438006120.html
CN,"2020 portable mini washing machine, suitable for personal travel",$11.99-$13.99,100 Units,https://www.alibaba.com///www.alibaba.com/product-detail/2020-portable-mini-washing-machine-suitable_1600093147245.html
CN,4.5kg Mini Washing Machine Wash machine without dryer,$13.00-$15.00,50 Pieces,https://www.alibaba.com///www.alibaba.com/product-detail/4-5kg-Mini-Washing-Machine-Wash_1600178861595.html
CN,High Quality 2020 hot sale mini Washer Dryer Cloth Washing Machine automatic mini washing machine,$15.00-$20.00,50 Pieces,https://www.alibaba.com///www.alibaba.com/product-detail/High-Quality-2020-hot-sale-mini_1600120391364.html
CN,Manufactory Wholesale mini washing machine 5kg mini ultrasonic washing machine mini twin tub washing machine manufacturer,$17.00-$22.00,10 Sets,https://www.alibaba.com///www.alibaba.com/product-detail/Manufactory-Wholesale-mini-washing-machine-5kg_62573227300.html
CN,Portable Folding Mini Washing Machine Laundry Bucket Automatic Clothes Washing Machine,$28.65-$30.88,2 Pieces,https://www.alibaba.com///www.alibaba.com/product-detail/Portable-Folding-Mini-Washing-Machine-Laundry_1600083035905.html
VN,Automatic Industrial Laundry Washing Machine 30Kg in hotel/ hospital/ factory,"$8,500.00-$10,000.00",1.0 Sets,https://www.alibaba.com///www.alibaba.com/product-detail/Automatic-Industrial-Laundry-Washing-Machine-30Kg_1600097708561.html
CN,New style cheap price high quality cosmetic mini eyelash washing machine,$2.20-$2.80,50.0 Pieces,https://www.alibaba.com///www.alibaba.com/product-detail/New-style-cheap-price-high-quality_1600106375320.html
CN,portable pocket ultrasonic handy washing machine for women,$10.98-$13.98,100.0 Pieces,https://www.alibaba.com///www.alibaba.com/product-detail/portable-pocket-ultrasonic-handy-washing-machine_60873167211.html
CN,Personal portable mini baby clothes single drum washing machine,$13.09-$14.08,2 Pieces,https://www.alibaba.com///www.alibaba.com/product-detail/Personal-portable-mini-baby-clothes-single_1600115277957.html
CN,Amazon top seller 2020 new 2 in 1 upgrade mini washing machine foldable washing gadget with bucket Automatic Material,$13.99-$14.99,100 Pieces,https://www.alibaba.com///www.alibaba.com/product-detail/Amazon-top-seller-2020-new-2_1600058053765.html
