Country,Title,Price,Minimum_Order,URL
CN,8 Liter Bucket Super Shock Wave Turbo Washer Portable Mini Underwear Turbo Washing Machine Underwear Cleaning Machine,$25.00-$28.00,2 Pieces,https://www.alibaba.com///www.alibaba.com/product-detail/8-Liter-Bucket-Super-Shock-Wave_1600151149271.html
ZA,3kg mini semi-automatic household single tub Washing Machine,$25.00,100 Kiloamperes,https://www.alibaba.com///www.alibaba.com/product-detail/3kg-mini-semi-automatic-household-single_62021502179.html
CN,Portable Underwear Socks Folding Washing Machine Ultrasonic Washing Machine,$14.73-$16.83,10 Pieces,https://www.alibaba.com///www.alibaba.com/product-detail/Portable-Underwear-Socks-Folding-Washing-Machine_1600157229227.html
CN,2020 New Folding Design Portable Mini Clothes Washing Machine for Home Travel Self-Driving,$32.00-$58.00,2 Pieces,https://www.alibaba.com///www.alibaba.com/product-detail/2020-New-Folding-Design-Portable-Mini_1600117383631.html
CN,Fantastic folding washing machine Mini Automatic Fold Washing Machine Portable,$39.00-$45.00,5 Packs,https://www.alibaba.com///www.alibaba.com/product-detail/Fantastic-folding-washing-machine-Mini-Automatic_1600097116270.html
CN,High quality fully automatic top loading boiling WiFi control smart compact mini portable camping caravan rv washing machine,$185.00-$215.00,1 Carton,https://www.alibaba.com///www.alibaba.com/product-detail/High-quality-fully-automatic-top-loading_60783020230.html
CN,2020 latest product 860*505*970MM 460W twin bucket washing machine,$54.00-$55.00,150 Pieces,https://www.alibaba.com///www.alibaba.com/product-detail/2020-latest-product-860-505-970MM_1600095990934.html
CN,new product ideas 2021 mini washing machine baby for best selling,$22.00-$28.00,10 Sets,https://www.alibaba.com///www.alibaba.com/product-detail/new-product-ideas-2021-mini-washing_1600120848070.html
CN,Foldable Portable Washing Machine for Travel Portable Washing Machine Single Tub,$30.90-$39.50,2 Pieces,https://www.alibaba.com///www.alibaba.com/product-detail/Foldable-Portable-Washing-Machine-for-Travel_1600167767296.html
CN,New design factory supply personal mini ultrasonic turbine wash machine,$13.80-$15.80,100 Sets,https://www.alibaba.com///www.alibaba.com/product-detail/New-design-factory-supply-personal-mini_60803302296.html
CN,Personal portable mini baby clothes single drum washing machine,$22.00-$33.00,5 Pieces,https://www.alibaba.com///www.alibaba.com/product-detail/Personal-portable-mini-baby-clothes-single_1600184141250.html
CN,Automatic Household Mini Tube 3-5Kg Wash Cleaner Portable Washing Machine,$35.00-$66.00,1.0 Pieces,https://www.alibaba.com///www.alibaba.com/product-detail/Automatic-Household-Mini-Tube-3-5Kg_1600111441395.html
CN,Mini Home Apartment Dorms Portable Manual Washing Machine with Spin Dryer for Shoes and Clothes,$22.00-$33.00,5 Pieces,https://www.alibaba.com///www.alibaba.com/product-detail/Mini-Home-Apartment-Dorms-Portable-Manual_1600184590014.html
CN,Red color Mini manual clothes washing machine,$24.50-$25.00,99 Pieces,https://www.alibaba.com///www.alibaba.com/product-detail/Red-color-Mini-manual-clothes-washing_62574434688.html
CN,Fantastic Electric Automatic Portable Washing Machine Folding Mini Washing Machine,$50.90-$56.90,10 Sets,https://www.alibaba.com///www.alibaba.com/product-detail/Fantastic-Electric-Automatic-Portable-Washing-Machine_1700004941608.html
CN,super asia washing machine washing machine,$20.00-$22.00,200 Pieces,https://www.alibaba.com///www.alibaba.com/product-detail/super-asia-washing-machine-washing-machine_60422686440.html
CN,mini portable washing machine small washing machine 110V,$24.00-$28.00,50 Pieces,https://www.alibaba.com///www.alibaba.com/product-detail/mini-portable-washing-machine-small-washing_62064852426.html
CN,2021 Portable Foldable Mini Laundry Tub Washing Machines For Travelling,$69.90-$79.90,2 Pieces,https://www.alibaba.com///www.alibaba.com/product-detail/2021-Portable-Foldable-Mini-Laundry-Tub_1700005002120.html
CN,Mini Washing Machine Single Bucket Washing and dehydration Washing Machine For Children,$29.00-$29.50,200 Pieces,https://www.alibaba.com///www.alibaba.com/product-detail/Mini-Washing-Machine-Single-Bucket-Washing_1600184714082.html
